{
  "workId": "work_001",
  "title": "赵孟頫《行书光福重建塔记卷》中段局部",
  "style": "行书（亦常称行楷）",
  "source": "作品信息依据上海博物馆；当前展示图片的直接来源与授权仍需项目组核实",
  "images": {
    "original": "original.png",
    "binary": "binary.png",
    "skeleton": "skeleton.png",
    "strokeWidth": "stroke_width.png",
    "inkDensity": "ink_density.png",
    "voidCandidates": "void_candidates.png"
  },
  "guideText": "请先观看原作整体，再切换气脉、虚实和笔墨图层。注意这些可视化只是帮助观察笔画方向、墨色变化和留白关系，最终解释来自人工标注，而不是系统自动判断。",
  "annotations": [
    {
      "id": "qi_1",
      "type": "qi_flow",
      "label": "形断势连",
      "evidenceLayers": ["original", "skeleton", "binary"],
      "path": "M 18 24 C 30 32, 39 42, 48 56",
      "formal": "待填写：画面上客观能看到的笔画方向、距离或断连关系。",
      "perception": "待填写：普通用户观看时可能感到的连续、牵引或节奏感。",
      "aesthetic": "待填写：说明它如何帮助理解气脉，例如形断而势未断。"
    },
    {
      "id": "qi_2",
      "type": "qi_flow",
      "label": "转势",
      "evidenceLayers": ["original", "skeleton", "strokeWidth"],
      "path": "M 55 22 C 67 28, 71 42, 63 58",
      "formal": "待填写：画面上客观能看到的转向、回带或牵引。",
      "perception": "待填写：普通用户观看时可能感到的运动转折。",
      "aesthetic": "待填写：说明它如何帮助理解笔画之间的运动势能。"
    },
    {
      "id": "void_1",
      "type": "void_solid",
      "label": "字间呼吸",
      "evidenceLayers": ["original", "binary", "voidCandidates"],
      "box": { "x": 38, "y": 18, "width": 16, "height": 26 },
      "formal": "待填写：画面上客观能看到的字间空白或疏密关系。",
      "perception": "待填写：普通用户观看时可能感到的呼吸感、疏朗感或停顿。",
      "aesthetic": "待填写：说明空白如何参与结构和节奏，而不是没有内容。"
    },
    {
      "id": "void_2",
      "type": "void_solid",
      "label": "密处得空",
      "evidenceLayers": ["original", "binary", "voidCandidates"],
      "box": { "x": 60, "y": 46, "width": 18, "height": 22 },
      "formal": "待填写：画面上客观能看到的密集笔画旁的空白。",
      "perception": "待填写：普通用户观看时可能感到的平衡或松动。",
      "aesthetic": "待填写：说明虚实相生或计白当黑。"
    },
    {
      "id": "ink_1",
      "type": "brush_ink",
      "label": "由按转提",
      "evidenceLayers": ["original", "strokeWidth", "inkDensity"],
      "box": { "x": 22, "y": 62, "width": 20, "height": 12 },
      "formal": "待填写：画面上客观能看到的粗细、浓淡或飞白变化。",
      "perception": "待填写：普通用户观看时可能感到的轻重、速度或收放。",
      "aesthetic": "待填写：说明它提示笔墨轻重线索，但不能写成真实力道检测。"
    }
  ]
}
